{
  "schemaVersion": "1",
  "id": "repo-ai-governor-official",
  "version": "0.1.0",
  "kind": "skill-catalog",
  "packageRoot": "skills",
  "officialRoot": "skills/official",
  "sharedRoot": "skills/shared",
  "compatibility": {
    "repoAiGovernor": "^0.1.0"
  },
  "installTargets": {
    "codex": {
      "repoLocal": ".codex/skills",
      "userLocal": "$CODEX_HOME/skills",
      "mode": "native"
    },
    "github-copilot": {
      "repoLocal": ".github/skills",
      "userLocal": "$HOME/.copilot/skills",
      "mode": "hybrid"
    },
    "claude-code": {
      "repoLocal": ".claude/skills",
      "userLocal": "$HOME/.claude/skills",
      "mode": "native"
    }
  },
  "skills": [
    {
      "id": "governor-context-loader",
      "manifestPath": "skills/official/governor-context-loader/skill.json",
      "surfaces": ["codex", "github-copilot", "claude-code"],
      "defaultInstallMode": "native"
    },
    {
      "id": "governor-plan-runner",
      "manifestPath": "skills/official/governor-plan-runner/skill.json",
      "surfaces": ["codex", "github-copilot", "claude-code"],
      "defaultInstallMode": "native"
    },
    {
      "id": "governor-task-implementer",
      "manifestPath": "skills/official/governor-task-implementer/skill.json",
      "surfaces": ["codex", "github-copilot", "claude-code"],
      "defaultInstallMode": "native"
    },
    {
      "id": "governor-delivery-finisher",
      "manifestPath": "skills/official/governor-delivery-finisher/skill.json",
      "surfaces": ["codex", "github-copilot", "claude-code"],
      "defaultInstallMode": "native"
    }
  ]
}
